{
  "game": {
    "name": "survey_likert",
    "params": {
      "items": [
        {
          "id": "trust1",
          "a": 1.1,
          "thresholds": [
            -1.2,
            -0.2,
            0.7,
            1.7
          ]
        },
        {
          "id": "trust2",
          "a": 0.9,
          "thresholds": [
            -1.0,
            0.0,
            1.0,
            2.0
          ]
        },
        {
          "id": "trust3",
          "a": 1.3,
          "thresholds": [
            -0.8,
            0.2,
            1.2,
            2.2
          ]
        }
      ]
    }
  },
  "topic": {
    "name": "trust",
    "tags": [
      "survey"
    ],
    "notes": "Likert block"
  },
  "population": {
    "label": "adult_online",
    "country": "US"
  },
  "context": {
    "anonymity": true
  }
}